lat;long;name;adress
-739.856.546.198.733;407.484.284;Empire State Building; 350, 5th Avenue, Manhattan Community Board 5, Manhattan, New York County, New York, 10018, United States
-737.793.733.748.521;406.429.479;John F. Kennedy International Airport; JFK Access Road, Queens, New York, 11430, United States
-736.750.683;427.272.286;Ground Zero; 110, 8th Street, Downtown, City of Troy, Rensselaer County, New York, 12180, United States
-7.398.964.162.241;407.410.592;Flatiron Building; 175, 5th Avenue, Manhattan Community Board 5, Manhattan, New York County, New York, 10010, United States
-739.753.440.635.221;4.075.160.275;Chrysler Building; Lexington Avenue, Manhattan Community Board 6, Manhattan, New York County, New York, 10037, United States
-740.081.351.705.826;4.071.245.515;Woolworth Building; Broadway, Manhattan Community Board 1, Manhattan, New York County, New York, 10279, United States
-739.784.267;407.591.509;Rockefeller Plaza; Midtown, Manhattan, New York County, New York, 10111, United States
